,rule_num,rule_text
238,F.8.8,Impact Attenuator Data - IAD
239,F.8.8.1,All teams must include an Impact Attenuator Data (IAD) report as part of the SES.
240,F.8.8.2,"Impact Attenuator Functional Requirements
These are not test requirements
a. Decelerates the vehicle at a rate not exceeding 20 g average and 40 g peak
b. Energy absorbed must be more than 7350 J
When:
• Total mass of Vehicle is 300 kg
• Impact velocity is 7.0 m/s"
241,F.8.8.3,"When using the Standard Impact Attenuator, the SES must meet the following:
a. Test data will not be submitted
b. All other requirements of this section must be included.
c. Photos of the actual attenuator must be included
d. Evidence that the Standard IA meets the design criteria provided in the Standard Impact
Attenuator specification must be included with the SES. This may be a receipt or packing
slip from the supplier."
242,F.8.8.4,"The Impact Attenuator Data Report when NOT using the Standard Impact Attenuator must
include:
a. Test data that proves that the Impact Attenuator Assembly meets the Functional
Requirements F.8.8.2
b. Calculations showing how the reported absorbed energy and decelerations have been
derived.
c. A schematic of the test method.
d. Photos of the attenuator, annotated with the height of the attenuator before and after
testing."
243,F.8.8.5,The Impact Attenuator Test is valid for only one Competition Year
244,F.8.8.6,"Impact Attenuator Test Setup
a. During any test, the Impact Attenuator must be attached to the Anti Intrusion Plate using
the intended vehicle attachment method.
b. The Impact Attenuator Assembly must be attached to a structurally representative
section of the intended chassis.
The test fixture must have equivalent strength and stiffness to a baseline front bulkhead.
A solid block of material in the shape of the front bulkhead is not “structurally
representative”.
c. There must be 50 mm minimum clearance rearwards of the Anti Intrusion Plate to the
test fixture.
d. No part of the Anti Intrusion Plate may permanently deflect more than 25 mm beyond
the position of the Anti Intrusion Plate before the test.
The 25 mm spacing represents the front bulkhead support and insures that the plate does not
intrude excessively into the cockpit."
245,F.8.8.7,"Test Conduct
a. Composite Impact Attenuators must be Dynamic Tested.
Other Impact Attenuator constructions may be Dynamic Tested or Quasi-Static Tested
b. Dynamic Testing (sled, pendulum, drop tower, etc.) of the Impact Attenuator must be
conducted at a dedicated test facility. This facility may be part of the University, but must
be supervised by professional staff or the University faculty. Teams must not construct
their own dynamic test apparatus.
c. Quasi-Static Testing may be performed by teams using their University’s
facilities/equipment, but teams are advised to exercise due care when performing all
tests."
246,F.8.8.8,"Test Analysis
a. When using acceleration data from the dynamic test, the average deceleration must be
calculated based on the raw unfiltered data.
b. If peaks above the 40 g limit are present in the data, a Channel Filter Class (CFC) 60
(100Hz) filter per SAE Recommended Practice J211 “Instrumentation for Impact Test”, or
a 100 Hz, 3rd order, low pass Butterworth (-3dB at 100 Hz) filter may be applied."
247,F.9,"FUEL SYSTEM (IC ONLY)
Fuel System Location and Protection are subject to approval during SES review and Technical
Inspection."
248,F.9.1,Location
249,F.9.1.1,"Any portion of the Fuel System that is less than 350 mm above the ground, and all parts of the
Fuel Tank, must be inside the Primary Structure (F.1.10)."
250,F.9.1.2,"In side view, any portion of the Fuel System must not project below the lower surface of the
chassis"
251,F.9.2,"Protection
All Fuel Tanks must be shielded from side or rear impact"
252,F.10,ACCUMULATOR CONTAINER (EV ONLY)
253,F.10.1,General Requirements
254,F.10.1.1,"All Accumulator Containers must be:
a. Designed to withstand forces from deceleration in all directions
b. Made from a Nonflammable Material ( F.1.18 )"
255,F.10.1.2,"Design of the Accumulator Container must be documented in the SES.
Documentation includes materials used, drawings/images, fastener locations, cell/segment
weight and cell/segment position."
256,F.10.1.3,"The Accumulator Containers and mounting systems are subject to approval during SES review
and Technical Inspection"
257,F.10.1.4,"If the Accumulator Container is not constructed from steel or aluminum, the material
properties should be established at a temperature of 60°C"
258,F.10.1.5,"If adhesives are used for credited bonding, the bond performance should be established at a
temperature of 60°C"
259,F.10.2,External Structure
260,F.10.2.1,"The Floor or Bottom must be made from one of the three:
a. Steel 1.25 mm minimum thickness
b. Aluminum 3.2 mm minimum thickness
c. Equivalent Alternate / Composite materials ( F.4.1, F.4.3 )"
261,F.10.2.2,"Vertical Walls, Covers and Lids must be made from one of the three:
a. Steel 0.9 mm minimum thickness
b. Aluminum 2.3 mm minimum thickness
c. Equivalent Alternate / Composite materials ( F.4.1, F.4.3 )"
262,F.10.2.3,"The accepted methods of joining walls to walls and walls to floor are:
a. Welding
• Welds may be continuous or interrupted.
• If interrupted, the weld/space ratio must be 1:1 or higher
• All weld lengths must be more than 25 mm
b. Fasteners
Combined strength of the fasteners must be Equivalent to the strength of the welded
joint ( F.10.2.3.a above )
c. Bonding
• Bonding must meet F.5.5
• Strength of the bonded joint must be Equivalent to the strength of the welded joint
( F.10.2.3.a above )
• Bonds must run the entire length of the joint"
263,F.10.2.4,"Covers and Lids must be attached with a minimum of one fastener F.10.2.3.b for each external
vertical wall per section"
264,F.10.3,Internal Structure
265,F.10.3.1,"Walls
a. Construction of Internal walls (vertical or horizontal) separating cells and/or segments
must meet F.10.2.2
b. Internal vertical walls separating cells and/or segments:
• Must have minimum height of the full height of the Accumulator Segments
• Should extend to the lid above any segment
c. Fastened connections between the floor and any vertical wall of each Section must have
minimum of two fasteners
d. Removable horizontal interior walls must be fastened with a minimum of one fastener
for each external vertical wall per section
Folding or bending plate material to create flanges or to eliminate joints between walls is
recommended."
266,F.10.3.2,"Sections
a. Internal vertical walls divide the Accumulator Container into “Sections”
b. A maximum of 12 kg is allowed in any Section
c. Fastened connections between vertical walls around Sections containing 8kg or less must
have a minimum of two fasteners
d. Fastened connections between vertical walls around sections containing between 8 kg
and 12 kg must have a minimum of three fasteners"
267,F.10.3.3,"If segments are arranged vertically above other segments, each layer of segments must have a
load path to the Chassis attachments that does not pass through another layer of segments"
268,F.10.3.4,"Cells and Segments
a. The cells and/or segments must be appropriately secured against moving inside the
Container.
b. This mounting system design must withstand the following accelerations:
40 g in the longitudinal direction (forward/aft)
40 g in the lateral direction (left/right)
20 g in the vertical direction (up/down)
c. Calculations and/or tests proving these requirements are met must be included in the
SES.
d. Any fasteners must be 6 mm or 1/4” minimum diameter"
269,F.10.4,Holes and Openings
270,F.10.4.1,"The Accumulator Container(s) exterior or interior walls may contain holes or openings, see
EV.4.3.4"
271,F.10.4.2,Any Holes and Openings must be the minimum area necessary
272,F.10.4.3,Exterior and interior walls must cover a minimum of 75% of each face of the battery segments
273,F.10.4.4,"Holes and Openings for airflow:
a. Must be round. Slots are prohibited
b. Should be maximum 10 mm diameter
c. Must not have line of sight to the driver, with the Firewall installed or removed"
274,F.10.5,Attachment
275,F.10.5.1,Attachment of the Accumulator Container must be documented in the SES
276,F.10.5.2,"Accumulator Containers must:
a. Attach to the Major Structure of the chassis
A maximum of two attachment points may be on a chassis tube between two
triangulated nodes.
b. Not attach to the Shoulder Harness Mounting"
277,F.10.5.3,"Any fasteners used to attach Accumulator Container(s) are Critical Fasteners, see T.8.2"
278,F.10.5.4,"Each fastened attachment point to a composite Accumulator Container requires backing
plates that are one of the two:
a. Steel with a thickness of 2 mm minimum
b. Alternate materials Equivalent to 2 mm thickness steel"
279,F.10.5.5,"Teams must justify the Accumulator Container attachment using one of the two methods:
• Corner Attachments and Analysis per F.10.5.6 and F.10.5.8
• Load Based Analysis per F.10.5.7 and F.10.5.8"
280,F.10.5.6,"Accumulator Attachment – Corner Attachments
a. Eight or more attachments are required for any configuration.
• One attachment for each corner of a rectangular structure of multiple Accumulator
Segments
• More than the minimum number of fasteners may be required for non rectangular
arrangements
Examples: If not filled in with additional structure, an extruded L shape would require
attachments at 10 convex corners (the corners at the inside of the L are not convex);
an extruded hexagon would require 12 attachments
b. The mechanical connections at each corner must be 50 mm or less from the corner of
the Segment
c. Each attachment point must be able to withstand a Test Load equal to 1/4 of total mass
of the container accelerating at 40 g"
281,F.10.5.7,"Accumulator Attachment – Load Based
a. The minimum number of attachment points depends on the total mass of the container:
Accumulator Weight Minimum Attachment Points
< 20 kg 4
20 – 30 kg 6
30 – 40 kg 8
> 40 kg 10
b. Each attachment point, including any brackets, backing plates and inserts, must be able
to withstand 15 kN minimum in any direction"
282,F.10.5.8,"Accumulator Attachment – All Types
a. Every fastener must withstand the Test Load in pure shear, using the minor diameter if
any threads are in shear
b. Every Accumulator bracket, chassis bracket, or monocoque attachment point must
withstand the Test Load in bending, in pure tearout, pure pullout, pure weld shear if
welded, and pure bond shear and pure bond tensile if bonded.
c. Monocoque attachment points must meet F.7.8.8
d. Fasteners must be spaced minimum 50 mm apart to be counted as separate attachment
points"
283,F.11,"TRACTIVE SYSTEM (EV ONLY)
Tractive System Location and Protection are subject to approval during SES review and
Technical Inspection."
284,F.11.1,Location
285,F.11.1.1,All Accumulator Containers must lie inside the Primary Structure (F.1.10).
286,F.11.1.2,"When used, Outboard Wheel Motors and their connections must meet EV.4.1.3"
287,F.11.1.3,"Tractive System (EV.1.1) components including cables and wiring other than those in F.11.1.2
above must be contained inside one or both of:
• The Rollover Protection Envelope F.1.13
• Structure meeting F.5.16 Component Protection"
288,F.11.2,Protection
289,F.11.2.1,"Side Impact Protection
a. All Accumulator Containers must be protected from side impact by structure Equivalent
to Side Impact Structure (F.6.4, F.7.5)
The Accumulator Container must not be part of the Equivalent structure.
b. Accumulator Container side impact protection must go to a minimum height that is the
lower of the two:
• The height of the Upper Side Impact Structure
• The top of the Accumulator Container at that point
c. Tractive System components other than Accumulator Containers in a position below 350
mm from the ground must be protected from side impact by structure that meets F.5.16
Component Protection"
290,F.11.2.2,"Rear Impact Protection
a. All Accumulator Containers must be protected from rear impact:
• When the rear impact structure is 100 mm or less from an Accumulator Container,
the structure must be Equivalent to Side Impact Structure (F.6.4, F.7.5)
• When the rear impact structure is more than 100 mm from an Accumulator
Container, the structure must meet F.5.16 Component Protection
• The Accumulator Container must not be part of the Equivalent structure.
b. The Rear Impact Protection for the Accumulator Container must:
• Go to the Upper Side Impact Height at minimum
• Have a structural and triangulated load path from the top of the Rear Impact
Protection to the Upper Side Impact Structure F.6.4, F.7.5 at the Main Hoop
• Have a structural and triangulated load path from the bottom of the Rear Impact
Protection to the Lower Side Impact Structure F.6.4, F.7.5 at the Main Hoop
c. Other Tractive System components in a position below 350 mm from the ground must be
protected from rear impact by structure meeting F.5.16 Component Protection
d. Differential mounts or a plate behind upper and lower rear impact tubes may be used as
Rear Impact Protection.
If used, the mounts or plate must be 25 mm or more larger at both the top and bottom
of the upper and lower tubes"
291,F.11.2.3,"All Non Crushable Items should have a minimum 25 mm clearance to the surface of the
Accumulator Container.
Non Crushable Items include, but are not limited to motors, differentials, and the side or rear
impact structure itself. Accumulator mounts do not require clearance"
292,F.11.2.4,"Non Crushable Items mounted behind the Rear Impact structure must not be able to come
through the Rear Impact structure."
