,rule_num,rule_text
0,F.1,DEFINITIONS
1,F.1.1,"Chassis
The fabricated structural assembly that supports all functional vehicle systems.
This assembly may be a single fabricated structure, multiple fabricated structures or a
combination of composite and welded structures."
2,F.1.2,"Frame Member
A minimum representative single piece of uncut, continuous tubing."
3,F.1.3,"Monocoque
A type of Chassis where loads are supported by the external panels"
4,F.1.4,"Main Hoop
A roll bar located alongside or immediately aft of the driver’s torso."
5,F.1.5,"Front Hoop
A roll bar located above the driver’s legs, in proximity to the steering wheel."
6,F.1.6,"Roll Hoop(s)
Referring to both the Front Hoop AND the Main Hoop"
7,F.1.7,"Roll Hoop Bracing Supports
The structure from the lower end of the Roll Hoop Bracing back to the Roll Hoop(s)."
8,F.1.8,"Front Bulkhead
A planar structure that provides protection for the driver’s feet."
9,F.1.9,"Impact Attenuator
A deformable, energy absorbing device located forward of the Front Bulkhead."
10,F.1.10,"Primary Structure
The combination of the following components:
• Front Bulkhead and Front Bulkhead Support
• Front Hoop, Main Hoop, Roll Hoop Braces and Supports
• Side Impact Structure
• (EV Only) Tractive System Protection and Rear Impact Protection
• Any Frame Members, guides, or supports that transfer load from the Driver Restraint
System"
11,F.1.11,"Primary Structure Envelope
A volume enclosed by multiple tangent planes, each of which follows the exact outline of the
Primary Structure Frame Members"
12,F.1.12,"Major Structure
The portion of the Chassis that lies inside the Primary Structure Envelope, excluding the Main
Hoop Bracing and the portion of the Main Hoop above a horizontal plane located at the top of
the Upper Side Impact Member or top of the Side Impact Zone."
13,F.1.13,"Rollover Protection Envelope
The Primary Structure plus a plane from the top of the Main Hoop to the top of the Front
Hoop, plus a plane from the top of the Main Hoop to the rearmost Triangulated structural
tube, or monocoque equivalent.
* If there are no Triangulated Structural members aft of the Main Hoop, the Rollover
Protection Envelope ends at the rear plane of the Main Hoop
*"
14,F.1.14,"Tire Surface Envelope
The volume enclosed by tangent lines between the Main Hoop and the outside edge of each
of the four tires."
15,F.1.15,"Component Envelope
The area that is inside a plane from the top of the Main Hoop to the top of the Front
Bulkhead, plus a plane from the top of the Main Hoop to the rearmost Triangulated structural
tube, or monocoque equivalent. * see note in step F.1.13 above
*"
16,F.1.16,"Buckling Modulus (EI)
Equal to E*I, where E = modulus of Elasticity, and I = area moment of inertia about the
weakest axis."
17,F.1.17,"Triangulation
An arrangement of Frame Members where all members and segments of members between
bends or nodes with Structural tubes form a structure composed entirely of triangles.
a. This is generally required between an upper member and a lower member, both of
which may have multiple segments requiring a diagonal to form multiple triangles.
b. This is also what is meant by “properly triangulated”.
mm
053
YES NO"
18,F.1.18,"Nonflammable Material
Metal or a Non Metallic material which meets UL94-V0, FAR25 or approved equivalent"
19,F.2,DOCUMENTATION
20,F.2.1,Structural Equivalency Spreadsheet - SES
21,F.2.1.1,"The SES is a supplement to the Formula SAE Rules and may provide guidance or further details
in addition to those of the Formula SAE Rules."
22,F.2.1.2,"The SES provides the means to:
a. Document the Primary Structure and show compliance with the Formula SAE Rules
b. Determine Equivalence to Formula SAE Rules using an accepted basis"
23,F.2.2,Structural Documentation
24,F.2.2.1,"All teams must submit a Structural Equivalency Spreadsheet (SES) as given in section DR -
Document Requirements"
25,F.2.3,Equivalence
26,F.2.3.1,"Equivalency in the structural context is determined and documented with the methods in the
SES"
27,F.2.3.2,"Any Equivalency calculations must prove Equivalency relative to Steel Tubing in the same
application"
28,F.2.3.3,"The properties of tubes and laminates may be combined to prove Equivalence.
For example, in a Side Impact Structure consisting of one tube per F.3.2.1.e and a laminate
panel, the panel only needs to be Equivalent to two Side Impact Tubes."
29,F.2.4,"Tolerance
Tolerance on dimensions given in the rules is allowed and is addressed in the SES."
30,F.2.5,"Fabrication
Vehicles must be fabricated in accordance with the design, materials, and processes described
in the SES."
31,F.3,TUBING AND MATERIAL
32,F.3.1,"Dimensions
Diameter and Wall Thickness values provided in this Section F.3 are based on dimensions for
commonly available tubing."
33,F.3.2,Tubing Requirements
34,F.3.2.1,"Requirements by Application
Steel Tube Must Alternative Tubing
Application Meet Size per Material Permitted"
35,F.3.4:,"per F.3.5 ?
a. Front Bulkhead Size B Yes
b. Front Bulkhead Support Size C Yes
c. Front Hoop Size A Yes
d. Front Hoop Bracing Size B Yes
e. Side Impact Structure Size B Yes
f. Bent / Multi Upper Side Impact Member Size D Yes
g. Main Hoop Size A NO
h. Main Hoop Bracing Size B NO
i. Main Hoop Bracing Supports Size C Yes
j. Driver Restraint Harness Attachment Size B Yes
k. Shoulder Harness Mounting Bar Size A NO
l. Shoulder Harness Mounting Bar Bracing Size C Yes
m. Accumulator Protection Structure Size B Yes
n. Component Protection Size C Yes
o. Structural Tubing Size C Yes"
36,F.3.3,Non Structural Tubing
37,F.3.3.1,"Definition
Any tubing which does NOT meet F.3.2.1.o Structural Tubing"
38,F.3.3.2,"Applicability
Non Structural Tubing is ignored when assessing compliance to any rule"
39,F.3.4,Steel Tubing and Material
40,F.3.4.1,"Minimum Requirements for Steel Tubing
A tube must meet all four minimum requirements for each Size specified:
Minimum Minimum Minimum
Minimum
Area Cross Outside Example Sizes of
Tube Wall
Moment of Sectional Diameter or Round Tube
Thickness
Inertia Area Square Width
1.0” x 0.095”
a. Size A 11320 mm4 173 mm2 25.0 mm 2.0 mm
25 x 2.5 mm
1.0” x 0.065”
b. Size B 8509 mm4 114 mm2 25.0 mm 1.2 mm
25.4 x 1.6 mm
1.0” x 0.049”
c. Size C 6695 mm4 91 mm2 25.0 mm 1.2 mm
25.4 x 1.2 mm
1.375” x 0.049”
d. Size D 18015 mm4 126 mm2 35.0 mm 1.2 mm
35 x 1.2 mm"
41,F.3.4.2,"Properties for ANY steel material for calculations submitted in an SES must be:
a. Non Welded Properties for continuous material calculations:
Young’s Modulus (E) = 200 GPa (29,000 ksi)
Yield Strength (Sy) = 305 MPa (44.2 ksi)
Ultimate Strength (Su) = 365 MPa (52.9 ksi)
b. Welded Properties for discontinuous material such as joint calculations:
Yield Strength (Sy) = 180 MPa (26 ksi)
Ultimate Strength (Su) = 300 MPa (43.5 ksi)"
42,F.3.4.3,"Where Welded tubing reinforcements are required (such as inserts for bolt holes or material
to support suspension cutouts), Equivalence of the Welded tube and reinforcement must be
shown to the original Non Welded tube in the SES"
43,F.3.5,Alternative Tubing Materials
44,F.3.5.1,Alternative Materials may be used for applications shown as permitted in F.3.2.1
45,F.3.5.2,"If any Alternative Materials are used, the SES must contain:
a. Documentation of material type, (purchase receipt, shipping document or letter of
donation) and the material properties.
b. Calculations that show equivalent to or better than the minimum requirements for steel
tubing in the application as listed in F.3.4.1 for yield and ultimate strengths matching the
Non Welded Steel properties from F.3.4.2.a above in bending, buckling and tension, for
buckling modulus and for energy dissipation
c. Details of the manufacturing technique and process"
46,F.3.5.3,"Aluminum Tubing
a. Minimum Wall Thickness for Aluminum Tubing: Non Welded 2.0 mm
Welded 3.0 mm
b. Non Welded properties for aluminum alloy 6061-T6 for calculations in an SES must be:
Young’s Modulus (E) 69 GPa (10,000 ksi)
Yield Strength (Sy) 240 MPa (34.8 ksi)
Ultimate Strength (Su) 290 MPa (42.1 ksi)
c. Welded properties for aluminum alloy 6061-T6 for calculations in an SES must be:
Yield Strength (Sy) 115 MPa (16.7 ksi)
Ultimate Strength (Su) 175 MPa (25.4 ksi)
d. If welding is used on a regulated aluminum structure, the equivalent yield strength must
be considered in the “as welded” condition for the alloy used unless the team provides
detailed proof that the frame or component has been properly solution heat treated,
artificially aged, and not subject to heating during team manufacturing.
e. If aluminum was solution heat treated and age hardened to increase its strength after
welding, the team must supply evidence as to how the process was performed.
This includes, but is not limited to, the heat treating facility used, the process applied,
and the fixturing used."
47,F.4,COMPOSITE AND OTHER MATERIALS
48,F.4.1,"Requirements
If any composite or other material is used, the SES must contain:"
49,F.4.1.1,"Documentation of material type, (purchase receipt, shipping document or letter of donation)
and the material properties."
50,F.4.1.2,"Details of the manufacturing technique and/or composite layup technique as well as the
structural material used (examples - cloth type, weight, and resin type, number of layers, core
material, and skin material if metal)."
51,F.4.1.3,"Calculations that show equivalence of the structure to one of similar geometry made to meet
the minimum requirements for a structure made from steel tubing per F.3.2. Equivalency
calculations must be submitted for energy dissipation, yield and ultimate strengths in bending,
buckling, and tension."
52,F.4.1.4,"Construction dates of the test panel(s) and monocoque, and approximate age(s) of the
materials used.
The intent is for the test panel to use the same material batch, material age, material storage,
and student layup quality as the monocoque."
53,F.4.2,"Quasi-Isotropic Layup
A layup with equal fiber strength and stiffness along any orientation in the plane of the layup.
a. When a layup has equal fiber properties and mass in the 0/90/+45/-45 directions, the
layup may be considered Quasi-Isotropic"
54,F.4.3,Laminate and Material Testing
55,F.4.3.1,"Testing Requirements
a. Any tested samples must be engraved with the construction date, sample name, and
peak test force.
b. The same set of test results must not be used for different monocoques in different
years.
The intent is for the test panel to use the same material batch, material age, material storage,
and student layup quality as the monocoque."
56,F.4.3.2,"Primary Structure Laminate Testing
Teams must build new representative test panels for each ply schedule used in the regulated
regions of the new chassis as a flat panel and perform a 3 point bending test on these panels.
Refer to F.4.3.4
a. Test panels must:
• Measure one of the two options: 138 mm x 500 mm OR 275 mm x 500 mm
• Be supported by a span distance of 400 mm
• Have equal surface area for the top and bottom skin
• Have bare edges, without skin material
b. The SES must include:
• Data from the 3 point bending tests
• Pictures of the test samples
• A picture of the test sample and test setup showing a measurement documenting
the supported span distance used in the SES
c. Test panel results must be used to derive stiffness, yield strength, ultimate strength and
absorbed energy properties by the SES formula and limits for the purpose of calculating
laminate panels equivalency corresponding to Primary Structure regions of the chassis.
d. Test panels must use the thickest core associated with each skin layup.
Designs may use core thickness that is 50% - 100% of the test panel core thickness
associated with each skin layup.
e. Calculation of derived properties must use the part of test data where deflection is 50
mm or less
f. Calculation of absorbed energy must use the integral of force times displacement"
57,F.4.3.3,"Comparison Test
Teams must make an equivalent test that will determine any compliance in the test rig and
establish an absorbed energy value of the baseline tubes.
a. The comparison test must use two Side Impact steel tubes (F.3.2.1.e)
b. The steel tubes must be tested to a minimum displacement of 19.0 mm
c. The calculation of absorbed energy must use the integral of force times displacement
from the initiation of load to a displacement of 19.0 mm"
58,F.4.3.4,"Test Conduct
a. The Laminate test F.4.3.2 and the Comparison test F.4.3.2e must use the same fixture
b. The load applicator used to test any panel/tubes as required in this section F.4.3 must
be:
• Metallic
• Radius 50 mm
c. The load applicator must overhang the test piece to prevent edge loading
d. Any other material must not be placed between the load applicator and the items on test
Load Applicator
R 50 mm
Front View Test Specimen Side View"
59,F.4.3.5,"Perimeter Shear Test
a. The Perimeter Shear Test must be completed by measuring the force required to push or
pull a 25 mm diameter flat punch through a flat laminate sample.
b. The sample must:
• Measure 100 mm x 100 mm minimum
• Have core and skin thicknesses identical to those used in the actual application
• Be manufactured using the same materials and processes
c. The fixture must support the entire sample, except for a 32 mm hole aligned coaxially
with the punch.
d. The sample must not be clamped to the fixture
e. The edge of the punch and hole in the fixture may include an optional fillet up to a
maximum radius of 1 mm.
f. The SES must include force and displacement data and photos of the test setup.
g. The first peak in the load-deflection curve must be used to determine the skin shear
strength; this may be less than the minimum force required by F.7.3.3 / F.7.5.5
h. The maximum force recorded must meet the requirements of F.7.3.3 / F.7.5.5"
60,F.4.3.6,"Additional Testing
When a laminate schedule(s) are NOT a Quasi-Isotropic Layup (F.4.2):
a. Results from the 3 point bending test will be assigned to the 0 layup direction.
b. The monocoque must have the tested layup direction normal to the cross sections used
for Equivalence in the SES, with allowance for taper of the monocoque normal to the
cross section.
c. All material properties in the weakest direction must be 50% or more of those in the
strongest direction as calculated by the SES."
61,F.4.3.7,"Lap Joint Test
The Lap Joint Test measures the force required to pull apart a joint comprised of two laminate
samples that are bonded together.
a. Do two separate pull tests with different orientations of the adhesive joint:
• Parallel to the pull direction, with the adhesive joint in pure shear
• T peel normal to the pull direction, with the adhesive joint in peel
b. The samples used must:
• Have skin thicknesses identical to those used in the actual monocoque
• Be manufactured using the same materials and processes
• Have the same overlap as used in the regulated structure. No scaling is permitted.
c. The force and displacement data and photos of the test setup must be included in the
SES.
d. The shear strength of the bond must be more than the UTS of the skin"
62,F.4.4,Equivalent Flat Panel Calculation
63,F.4.4.1,"When specified, the Equivalence of the chassis must be calculated as a flat panel with the
same composition as the chassis about the neutral axis of the laminate."
64,F.4.4.2,"The curvature of the panel and geometric cross section of the chassis must be ignored for
these calculations."
65,F.4.4.3,"Calculations of Equivalence that do not reference this section F.4.4 may use the actual
geometry of the chassis."
66,F.5,"CHASSIS REQUIREMENTS
This section applies to all Chassis, regardless of material or construction"
67,F.5.1,Primary Structure
68,F.5.1.1,"The Primary Structure must be constructed from one or a combination of the following:
• Steel Tubing and Material F.3.2 F.3.4
• Alternative Tubing Materials F.3.2 F.3.5
• Composite Material F.4"
69,F.5.1.2,"Any chassis design that combines the Tube Frame, Monocoque, tubing and/or composite
types must:
a. Meet all relevant requirements F.5.1.1
b. Show Equivalence F.2.3, as applicable
c. Any connections must meet F.5.4, F.5.5, F.7.8 as applicable, or Equivalent."
70,F.5.2,Bent Tubes or Multiple Tubes
71,F.5.2.1,"The minimum radius of any bend, measured at the tube centerline, must be three or more
times the tube outside diameter (3 x OD)."
72,F.5.2.2,Bends must be smooth and continuous with no evidence of crimping or wall failure.
73,F.5.2.3,"If a bent tube (or member consisting of multiple tubes that are not in a line) is used anywhere
in the Primary Structure other than the Roll Hoops (see F.5.6.2), an additional tube must be
attached to support it.
a. The support tube attachment point must be at the position along the bent tube where it
deviates farthest from a straight line connecting both ends
b. The support tube must terminate at a node of the chassis
c. The support tube for any bent tube (other than the Upper Side Impact Member or
Shoulder Harness Mounting Bar) must be:
• The same diameter and thickness as the bent tube
• Angled no more than 30° from the plane of the bent tube"
74,F.5.3,Holes and Openings in Regulated Tubing
75,F.5.3.1,Any holes in any regulated tubing (other than inspection holes) must be addressed on the SES.
76,F.5.3.2,"Technical Inspectors may check the compliance of all tubes. This may be done by ultrasonic
testing or by the drilling of inspection holes on request."
77,F.5.3.3,"Regulated tubing other than the open lower ends of Roll Hoops must have any open ends
closed by a welded cap or inserted metal plug."
78,F.5.4,Fasteners in Primary Structure
79,F.5.4.1,"Bolted connections in the Primary Structure must use a removable bolt and nut.
Bonded fasteners and blind nuts and bolts do not meet this requirement"
80,F.5.4.2,"Threaded fasteners used in Primary Structure are Critical Fasteners, see T.8.2"
81,F.5.4.3,"Bolted connections in the Primary Structure using tabs or brackets must have an edge
distance ratio “e/D” of 1.5 or higher
“D” equals the hole diameter. “e” equals the distance from the edge of the hole to the nearest
free edge
Tabs attaching the Suspension to the Primary Structure are NOT “in the Primary Structure”"
82,F.5.5,Bonding in Regulated Structure
83,F.5.5.1,Adhesive used and referenced bonding strength must be appropriate for both substrate types
84,F.5.5.2,"Document the adhesive choice, age and expiration date, substrate preparation, and the
equivalency of the bonded joint in the SES"
85,F.5.5.3,The SES will reduce any referenced or tested adhesive values by 50%
86,F.5.6,Roll Hoops
87,F.5.6.1,The Chassis must include both a Main Hoop and a Front Hoop.
88,F.5.6.2,"The Main Hoop and Front Hoop must be Triangulated into the Primary Structure with
Structural Tubing
The Triangulation must be at a node in side view for:
a. Bends in side view
b. Bends in front view below the Upper Side Impact Structure F.6.4, F.7.5"
89,F.5.6.3,"Roll Hoop and Driver Position
When seated normally and restrained by the Driver Restraint System, the helmet of a 95th
percentile male (see V.2.1.1) and all of the team’s drivers must:
a. Be a minimum of 50 mm from the straight line drawn from the top of the Main Hoop to
the top of the Front Hoop.
b. Be a minimum of 50 mm from the straight line drawn from the top of the Main Hoop to
the lower end of the Main Hoop Bracing if the bracing extends rearwards.
c. Be no further rearwards than the rear surface of the Main Hoop if the Main Hoop Bracing
extends forwards.
Helmet must be forward
of this Line"
90,F.5.6.4,"Driver Template
A two dimensional template used to represent the 95th percentile male is made to the
following dimensions (see figure below):
• A circle of diameter 200 mm will represent the hips and buttocks.
• A circle of diameter 200 mm will represent the shoulder/cervical region.
• A circle of diameter 300 mm will represent the head (with helmet).
• A straight line measuring 490 mm will connect the centers of the two 200 mm circles.
• A straight line measuring 280 mm will connect the centers of the upper 200 mm circle
and the 300 mm head circle."
91,F.5.6.5,"Driver Template Position
The Driver Template will be positioned as follows:
• The seat will be adjusted to the rearmost position
• The pedals will be placed in the most forward position
• The bottom 200 mm circle will be placed on the seat bottom where the distance
between the center of this circle and the rearmost face of the pedals is no less than 915
mm
• The middle 200 mm circle, representing the shoulders, will be positioned on the seat
back
• The upper 300 mm circle will be positioned no more than 25 mm away from the head
restraint (where the driver’s helmet would normally be located while driving)
25 mm maximum
Rearmost
Pedal Face"
92,F.5.7,Front Hoop
93,F.5.7.1,The Front Hoop must be constructed of closed section metal tubing meeting F.3.2.1.c
94,F.5.7.2,"With proper Triangulation, the Front Hoop may be fabricated from more than one piece of
tubing"
95,F.5.7.3,"The Front Hoop must extend from the lowest Frame Member on one side of the Frame, up,
over and down to the lowest Frame Member on the other side of the Frame."
96,F.5.7.4,"The top-most surface of the Front Hoop must be no lower than the top of the steering wheel
in any angular position. See figure following F.5.9.6 below"
97,F.5.7.5,"The Front Hoop must be no more than 250 mm forward of the steering wheel.
This distance is measured horizontally, on the vehicle centerline, from the rear surface of the
Front Hoop to the forward most surface of the steering wheel rim with the steering in the
straight ahead position."
98,F.5.7.6,"In side view, any part of the Front Hoop above the Upper Side Impact Structure must be
inclined less than 20° from the vertical."
99,F.5.7.7,"A Front Hoop that is not steel must have a 4 mm hole drilled in a location to access during
Technical Inspection
mm
082"
100,F.5.8,Main Hoop
101,F.5.8.1,"The Main Hoop must be a single piece of uncut, continuous, closed section steel tubing
meeting F.3.2.1.g"
102,F.5.8.2,"The Main Hoop must extend from the lowest Frame Member / bottom of Monocoque on one
side of the Frame, up, over and down to the lowest Frame Member / bottom of Monocoque
on the other side of the Frame."
103,F.5.8.3,"In the side view of the vehicle,
a. The part of the Main Hoop that lies above its attachment point to the upper Side Impact
Tube must be less than 10° from vertical.
b. Any bends in the Main Hoop above its attachment point to the Major Structure of the
Chassis must be braced to a node or Attachment point F.7.8 with tubing meeting
F.3.2.1.h and F.5.9.5
c. The part of the Main Hoop below the Upper Side Impact Member attachment:
• May be forward at any angle
• Must not be rearward more than 10° from vertical"
104,F.5.8.4,"In the front view of the vehicle, the vertical members of the Main Hoop must be minimum 380
mm apart (inside dimension) at the location where the Main Hoop is attached to the bottom
tubes of the Major Structure of the Chassis."
105,F.5.9,Main Hoop Braces
106,F.5.9.1,Main Hoop Braces must be constructed of closed section steel tubing meeting F.3.2.1.h
107,F.5.9.2,"The Main Hoop must be supported by two Braces extending in the forward or rearward
direction, one on each of the left and right sides of the Main Hoop."
108,F.5.9.3,"In the side view of the Frame, the Main Hoop and the Main Hoop Braces must not lie on the
same side of the vertical line through the top of the Main Hoop.
(If the Main Hoop leans forward, the Braces must be forward of the Main Hoop, and if the
Main Hoop leans rearward, the Braces must be rearward of the Main Hoop)"
109,F.5.9.4,"The Main Hoop Braces must be attached 160 mm or less below the top most surface of the
Main Hoop.
The Main Hoop Braces should be attached as near as possible to the top of the Main Hoop"
110,F.5.9.5,The included angle formed by the Main Hoop and the Main Hoop Braces must be 30° or more.
111,F.5.9.6,"The Main Hoop Braces must be straight, without any bends."
112,F.5.9.7,"The Main Hoop Braces must be:
a. Securely integrated into the Frame
b. Capable of transmitting all loads from the Main Hoop into the Major Structure of the
Chassis without failing"
113,F.5.10,"Head Restraint Protection
An additional frame member may be added to meet T.2.8.3.b"
114,F.5.10.1,"If used, the Head Restraint Protection frame member must:
a. Attach to the nodes where the Main Hoop Braces F.5.9.2 connect to the Main Hoop
b. Be constructed of a single piece of uncut, continuous, closed section steel tubing meeting
F.3.2.1.h
c. Meet F.5.2.1 and F.5.2.2, as applicable (does not need to meet F.5.2.3)"
115,F.5.10.2,The Head Restraint or mounting T.2.8 must not attach to the Head Restraint Protection
116,F.5.11,External Items
117,F.5.11.1,"Any item which meets all three of:
• Located outside the Component Envelope F.1.15
• Located above 350 mm from the ground
• Could load the Main Hoop, Main Hoop Brace, or Shoulder Harness Mounting during a
rollover"
118,F.5.11.2,"External Items must meet one of the two conditions:
a. Be attached at a Hoop to Brace node or a fully Triangulated structural node without the
ability to create a moment at the node
b. When not attached at a node as described above, then:
• Additional Structural bracing meeting F.3.2.1.o must be added to prevent bending
loads
• Additional calculations must be performed to show the member will not fail in
bending or shear, even if unbraced"
119,F.5.11.3,External Items should not point at the driver
120,F.5.12,Mechanically Attached Roll Hoop Bracing
