,rule_num,rule_text
121,F.5.12.1,"When Roll Hoop Bracing is mechanically attached:
a. The threaded fasteners used to secure non permanent joints are Critical Fasteners, see
T.8.2. Additional requirements apply in F.5.12.5 and F.5.12.7
b. No spherical rod ends are allowed.
c. The attachment holes in the lugs, the attached bracing and the sleeves and tubes must
be a close fit with the pin or bolt."
122,F.5.12.2,"Any non permanent joint at the end(s) must be a Double Lug Joint or a Sleeved Butt Joint
Figure – Double Lug Joint"
123,F.5.12.3,"For Double Lug Joints, each lug must:
a. Be minimum 4.5 mm (0.177 in) thickness steel
b. Measure 25 mm minimum perpendicular to the axis of the bracing
c. Be as short as practical along the axis of the bracing."
124,F.5.12.4,"All Double Lug Joints, whether fitted parallel or perpendicular to the axis of the tube, must
include a capping arrangement"
125,F.5.12.5,"In a Double Lug Joint the pin or bolt must be 10 mm Metric Grade 9.8 or 3/8 in SAE Grade 8
minimum diameter and grade. See F.5.12.1 above
Figure – Sleeved Butt Joint"
126,F.5.12.6,"For Sleeved Butt Joints, the sleeve must:
a. Have a minimum length of 75 mm; 37.5 mm to each side of the joint
b. Be external to the base tubes, with a close fit around the base tubes.
c. Have a wall thickness of 2.0 mm or more"
127,F.5.12.7,"In a Sleeved Butt Joint, the bolts must be 6 mm Metric Grade 9.8 or 1/4 in SAE Grade 8
minimum diameter and grade. See F.5.12.1 above"
128,F.5.13,Other Bracing Requirements
129,F.5.13.1,"Where the braces are not welded to steel Frame Members, the braces must be securely
attached to the Frame using 8 mm or 5/16” minimum diameter Critical Fasteners, see T.8.2"
130,F.5.13.2,"Mounting plates welded to Roll Hoop Bracing must be 2.0 mm (0.080 in) minimum thickness
steel."
131,F.5.14,"Steering Protection
Steering system racks or mounting components that are external (vertically above or below)
to the Primary Structure must be protected from frontal impact. The protective structure
must:
a. Meet F.3.2.1.n or Equivalent
b. Extend to the vertical limit of the steering component(s)
c. Extend to the local width of the Chassis"
132,F.5.15,"Other Side Tube Requirements
If there is a Roll Hoop Brace or other frame tube alongside the driver, at the height of the neck
of any of the team’s drivers, a metal tube or piece of sheet metal must be attached to the
Frame
This is intended to prevent the drivers’ shoulders from passing under the Roll Hoop Brace or
frame tube, and the driver’s neck contacting this brace or tube."
133,F.5.16,"Component Protection
When specified in the rules, components must be protected by one or both of:
a. Fully Triangulated structure with tubes meeting F.3.2.1.n
b. Structure Equivalent to the above, as determined per F.4.1.3"
134,F.6,TUBE FRAMES
135,F.6.1,"Front Bulkhead
The Front Bulkhead must be constructed of closed section tubing meeting F.3.2.1.a"
136,F.6.2,Front Bulkhead Support
137,F.6.2.1,"Frame Members of the Front Bulkhead Support system must be constructed of closed section
tubing meeting F.3.2.1.b"
138,F.6.2.2,The Front Bulkhead must be securely integrated into the Frame.
139,F.6.2.3,"The Front Bulkhead must be supported back to the Front Hoop by a minimum of three Frame
Members on each side of the vehicle; an upper member; lower member and diagonal brace to
provide Triangulation.
a. The upper support member must be attached 50 mm or less from the top surface of the
Front Bulkhead, and attach to the Front Hoop inside a zone extending 100 mm above
and 50 mm below the Upper Side Impact member.
b. If the upper support member is further than 100 mm above the Upper Side Impact
member, then properly Triangulated bracing is required to transfer load to the Main
Hoop by one of:
• the Upper Side Impact member
• an additional member transmitting load from the junction of the Upper Support
Member with the Front Hoop
c. The lower support member must be attached to the base of the Front Bulkhead and the
base of the Front Hoop.
d. The diagonal brace must properly Triangulate the upper and lower support members"
140,F.6.2.4,"Each of the above members may be multiple or bent tubes provided the requirements of F.5.2
are met."
141,F.6.2.5,Examples of acceptable configurations of members may be found in the SES
142,F.6.3,Front Hoop Bracing
143,F.6.3.1,Front Hoop Braces must be constructed of material meeting F.3.2.1.d
144,F.6.3.2,"The Front Hoop must be supported by two Braces extending in the forward direction, one on
each of the left and right sides of the Front Hoop."
145,F.6.3.3,"The Front Hoop Braces must be constructed to protect the driver’s legs and should extend to
the structure in front of the driver’s feet."
146,F.6.3.4,"The Front Hoop Braces must be attached as near as possible to the top of the Front Hoop but
not more than 50 mm below the top-most surface of the Front Hoop. See figure following
F.5.9.6 above"
147,F.6.3.5,"If the Front Hoop above the Upper Side Impact Structure leans rearwards by more than 10°
from the vertical, it must be supported by additional rearward Front Hoop Braces to a fully
Triangulated structural node."
148,F.6.3.6,"The Front Hoop Braces must be straight, without any bends"
149,F.6.4,Side Impact Structure
150,F.6.4.1,"Frame Members of the Side Impact Structure must be constructed of closed section tubing
meeting F.3.2.1.e or F.3.2.1.f, as applicable"
151,F.6.4.2,"With proper Triangulation, Side Impact Structure members may be fabricated from more than
one piece of tubing."
152,F.6.4.3,"The Side Impact Structure must be comprised of three or more tubular members located on
each side of the driver while seated in the normal driving position
Diagonal Side Impact Member
Upper Side Impact Member
(completely in zone)
Lowest Point inside Cockpit
(example location)
Lower Side Impact Member"
153,F.6.4.4,"The Upper Side Impact Member must:
a. Connect the Main Hoop and the Front Hoop.
b. Be entirely in a zone that is parallel to the ground between 240 mm and 320 mm above
the lowest point of the top surface of the Lower Side Impact Member"
154,F.6.4.5,"The Lower Side Impact Structure member must connect the bottom of the Main Hoop and the
bottom of the Front Hoop.
mm
023
mm
042"
155,F.6.4.6,"The Diagonal Side Impact Member must:
a. Connect the Upper Side Impact Member and Lower Side Impact Member forward of the
Main Hoop and rearward of the Front Hoop
b. Completely Triangulate the bays created by the Upper and Lower Side Impact Members."
156,F.6.5,Shoulder Harness Mounting
157,F.6.5.1,"The Shoulder Harness Mounting Bar must:
a. Be a single piece of uncut, continuous, closed section steel tubing that meets F.3.2.1.k
b. Attach to the Main Hoop on both sides of the chassis"
158,F.6.5.2,"Bent Shoulder Harness Mounting Bars must:
a. Meet F.5.2.1 and F.5.2.2
b. Have bracing members attached at the bend(s) and to the Main Hoop.
• Material for this Shoulder Harness Mounting Bar Bracing must meet F.3.2.1.l
• The included angle in side view between the Shoulder Harness Bar and the braces
must be no less than 30°."
159,F.6.5.3,"The Shoulder Harness Mounting Bar should be loaded only by the Shoulder Harness
The Head Restraint, Firewall, driver’s seat and light bodywork may attach to the mounting bar"
160,F.6.6,Main Hoop Bracing Supports
161,F.6.6.1,"Frame Members of the Main Hoop Bracing Support system must be constructed of closed
section tubing meeting F.3.2.1.i"
162,F.6.6.2,"The lower end of the Main Hoop Braces must be supported back to the Main Hoop by a
minimum of two Frame Members on each side of the vehicle: an upper member and a lower
member in a properly Triangulated configuration.
a. The upper support member must attach to the node where the upper Side Impact
Member attaches to the Main Hoop.
b. The lower support member must attach to the node where the lower Side Impact
Member attaches to the Main Hoop.
c. Each of the above members may be multiple or bent tubes provided the requirements of
F.5.2 are met.
d. Examples of acceptable configurations of members may be found in the SES."
163,F.7,MONOCOQUE
164,F.7.1,General Requirements
165,F.7.1.1,"The Structural Equivalency Spreadsheet must show that the design is Equivalent to a welded
frame in terms of energy dissipation, yield and ultimate strengths in bending, buckling and
tension"
166,F.7.1.2,Composite and metallic monocoques have the same requirements
167,F.7.1.3,Corners between panels used for structural equivalence must contain core
168,F.7.1.4,"An inspection hole approximately 4mm in diameter must be drilled through a low stress
location of every monocoque section regulated by the Structural Equivalency Spreadsheet
This inspection hole is not required in the Vertical Side Impact Structure F.7.5.3.b"
169,F.7.1.5,"Composite monocoques must:
a. Meet the materials requirements in F.4 Composite and Other Materials
b. Use data from the laminate testing results as the basis for any strength or stiffness
calculations"
170,F.7.2,Front Bulkhead
171,F.7.2.1,"When modeled as an “L” shaped section the EI of the Front Bulkhead about both vertical and
lateral axis must be equivalent to that of the tubes specified for the Front Bulkhead per F.6.1"
172,F.7.2.2,"The length of the section perpendicular to the Front Bulkhead may be a maximum of 25 mm
measured from the rearmost face of the Front Bulkhead"
173,F.7.2.3,"Any Front Bulkhead which supports the IA plate must have a perimeter shear strength
equivalent to a 1.5 mm thick steel plate"
174,F.7.3,Front Bulkhead Support
175,F.7.3.1,"In addition to proving that the strength of the monocoque is sufficient, the monocoque must
have equivalent EI to the sum of the EI of the six Steel Tubes (F.3.2.1.b) that it replaces."
176,F.7.3.2,"The EI of the vertical side of the Front Bulkhead support structure must be equivalent to or
more than the EI of one steel tube that it replaces when calculated as per F.4.4"
177,F.7.3.3,"The perimeter shear strength of the monocoque laminate in the Front Bulkhead support
structure must be 4 kN or more for a section with a diameter of 25 mm.
This must be proven by a physical test completed per F.4.3.5 and the results included in the
SES."
178,F.7.4,Front Hoop Attachment
179,F.7.4.1,"The Front Hoop must be mechanically attached to the monocoque
a. Front Hoop Mounting Plates must be the minimum thickness of the Front Hoop F.3.2.1.c
b. The Front Hoop tube must be mechanically connected to the Mounting Plate with
Mounting Plates parallel to both sides of the tube, with gussets from the Front Hoop
tube along both sides of the mounting plate"
180,F.7.4.2,"Front Hoop attachment to a monocoque must obey F.5.7.2 or F.7.8 within 25 mm of any
bends and nodes that are not at the top center of the Front Hoop"
181,F.7.4.3,"The Front Hoop may be fully laminated into the monocoque if:
a. The Front Hoop has core fit tightly around its entire circumference. Expanding foam is
not permitted
b. Equivalence to six or more mounts compliant with F.7.8 must show in the SES
c. A small gap in the laminate (approximately 25 mm) exists for inspection of the Front
Hoop F.5.7.6"
182,F.7.4.4,Adhesive must not be the sole method of attaching the Front Hoop to the monocoque
183,F.7.5,Side Impact Structure
184,F.7.5.1,"Side Impact Zone - the region longitudinally forward of the Main Hoop and aft of the Front
Hoop consisting of the combination of a vertical section up to 320 mm above the lowest point
of the upper surface of the floor to the bottom surface of the floor of the monocoque and half
the horizontal floor.
Side
Lowest Point Impact Structure
inside Chassis Side Bottom Surface
of Chassis Floor
Impact
Zone"
185,F.7.5.2,"The Side Impact Zone must have Equivalence to the three (3) Steel Tubes (F.3.2.1.e) that it
replaces"
186,F.7.5.3,"The portion of the Side Impact Zone that is vertically between the upper surface of the floor
and 320 mm above the lowest point of the upper surface of the floor (see figure above) must
have:
a. Equivalence to minimum two (2) Steel Tubes (F.3.2.1.e) per F.4.4
b. No openings in Side View between the Front Hoop and Main Hoop"
187,F.7.5.4,Horizontal floor Equivalence must be calculated per F.4.4
188,F.7.5.5,"The perimeter shear strength of the monocoque laminate must be 7.5 kN or more for a
section with a diameter of 25 mm.
This must be proven by physical test completed per F.4.3.5 and the results included in the SES."
189,F.7.6,Main Hoop Attachment
190,F.7.6.1,"The Main Hoop must be mechanically attached to the monocoque
a. Main Hoop mounting plates must be 2.0 mm minimum thickness steel
b. The Main Hoop tube must be mechanically connected to the mounting plate with 2.0
mm minimum thickness steel plates parallel to both sides of the tube, with gussets from
the Main Hoop tube along both sides of the mounting plate"
191,F.7.6.2,"Main Hoop attachment to a monocoque must obey F.7.8 within 25 mm of any bends and
nodes that are below the top of the monocoque"
192,F.7.7,"Roll Hoop Bracing Attachment
Attachment of tubular Front or Main Hoop Bracing to the monocoque must obey F.7.8."
193,F.7.8,Attachments
194,F.7.8.1,"Each attachment point between the monocoque or composite panels and the other Primary
Structure must be able to carry a minimum load of 30 kN in any direction.
a. When a Roll Hoop attaches in three locations on each side, the attachments must be
located at the bottom, top, and a location near the midpoint
mm
023
b. When a Roll Hoop attaches at only the bottom and a point between the top and the
midpoint on each side, each of the four attachments must show load strength of 45 kN in
all directions"
195,F.7.8.2,"If a tube frame ( F.6, F.11.2 ) meets the monocoque at the Attachments, the connection must
obey one of the two:
a. Parallel brackets attached to the two sides of the Main Hoop and the two sides of the
Side Impact Structure
b. Two mostly perpendicular brackets attached to the Main Hoop and the side and back of
the monocoque"
196,F.7.8.3,"The laminate, brackets, backing plates and inserts must have sufficient stiffness, shear area,
bearing area, weld area and strength to carry the load specified in F.7.8.1 in any direction.
Data obtained from the laminate perimeter shear strength test (F.4.3.5) must prove sufficient
shear area is provided."
197,F.7.8.4,Proof that the brackets are sufficiently stiff must be documented in the SES.
198,F.7.8.5,"Each attachment point requires no less than two 8 mm or 5/16” minimum diameter Critical
Fasteners, see T.8.2"
199,F.7.8.6,"Each attachment point requires backing plates which meet one of:
• Steel with a minimum thickness of 2 mm
• Alternate materials if Equivalency is approved"
200,F.7.8.7,"The Front Hoop Bracing, Main Hoop Bracing and Main Hoop Bracing Supports may use only
one 10 mm or 3/8” minimum diameter Critical Fasteners, see T.8.2 as an alternative to F.7.8.5
above if the bolt is on the centerline of the bracing tube to prevent loading the bolt in
bending, similar to the figure below.
CL
CL"
201,F.7.8.8,"Each Roll Hoop or Accumulator Container to Chassis attachment point must contain one of the
two:
a. A solid insert that is fully enclosed by both the inner and outer skin
b. Local elimination of any gap between inner and outer skin, with or without repeating
skin layups"
202,F.7.9,Driver Harness Attachment
203,F.7.9.1,"Required Loads
a. Each attachment point for the Shoulder Belts must support a minimum load of 15 kN
before failure with a required load of 30 kN distributed across both belt attachments.
b. Each attachment point for the Lap Belts must support a minimum load of 15 kN before
failure.
c. Each attachment point for the Anti-Submarine Belts must support a minimum load of 15
kN before failure.
d. If the Lap Belt and Anti-Submarine Belt mounting points are less than 125 mm apart, or
are attached to the same attachment point, then each mounting point must support a
minimum load of 30 kN before failure."
204,F.7.9.2,"Load Testing
The strength of Lap Belt, Shoulder Belt, and Anti-Submarine Belt attachments must be proven
by physical tests where the required load is applied to a representative attachment point
where the proposed layup and attachment bracket are used.
a. Edges of the test fixture supporting the sample must be a minimum of 125 mm from the
load application point (load vector intersecting a plane)
b. Test Load application of the Lap Belt and Anti Submarine Belts must be normal (90
degrees) to the plane of the test sample
c. Shoulder Belt Test Load application must meet:
Installed Shoulder Belt Angle: Test Load Application Angle must be: should be:
Between 90° and the installed
Between 90° and 45° 90°
Shoulder Belt Angle
Between 45° and 0° Between 90° and 45° 90°
The angles are measured from the plane of the Test Sample (90° is normal to the Test
Sample and 0° is parallel to the Test Sample)
d. The Shoulder Harness test sample must not be any larger than the section of the
monocoque as built
e. The width of the Shoulder Harness test sample must not be any wider than the Shoulder
Harness ""panel height"" (see Structural Equivalency Spreadsheet) used to show
equivalency for the Shoulder Harness mounting bar
f. Designs with attachments near a free edge must not support the free edge during the
test
The intent is that the test specimen, to the best extent possible, represents the vehicle as
driven at competition. Teams are expected to test a panel that is manufactured in as close a
configuration to what is built in the vehicle as possible"
205,F.8,FRONT CHASSIS PROTECTION
206,F.8.1,Requirements
207,F.8.1.1,"Forward of the Front Bulkhead there must be an Impact Attenuator with an Anti Intrusion
Plate between the Impact Attenuator and the Front Bulkhead."
208,F.8.1.2,"All methods of attachment of the Impact Attenuator to the Anti Intrusion Plate, and of the
Anti Intrusion Plate to the Front Bulkhead must provide sufficient load paths for transverse
and vertical loads if off-axis impacts occur."
209,F.8.2,Anti Intrusion Plate - AIP
210,F.8.2.1,"The Anti Intrusion Plate must be one of the following:
a. 1.5 mm minimum thickness solid steel
b. 4.0 mm minimum thickness solid aluminum plate
c. Composite material per F.8.3"
211,F.8.2.2,"The outside profile requirement of the Anti Intrusion Plate depends on the method of
attachment to the Front Bulkhead:
a. Welded joints: the profile must align with or be more than the centerline of the Front
Bulkhead tubes on all sides
b. Bolted joints, bonding, laminating: the profile must align with or be more than the
outside dimensions of the Front Bulkhead around the entire periphery"
212,F.8.2.3,"Attachment of the Anti Intrusion Plate directly to the Front Bulkhead must be documented in
the team’s SES submission. The accepted methods of attachment are:
a. Welding
• All weld lengths must be 25 mm or longer
• If interrupted, the weld/space ratio must be 1:1 or higher
b. Bolted joints
• Using no less than eight 8 mm or 5/16” minimum diameter Critical Fasteners, T.8.2.
• The distance between any two bolt centers must be 50 mm minimum.
• Each bolt attachment must have pullout, tearout and bending capabilities of 15 kN
c. Bonding
• The Front Bulkhead must have no openings
• The entire surface of the Anti Intrusion Plate must be bonded, with shear and peel
strength higher than 120 kN
d. Laminating
• The Anti Intrusion Plate must be in front of the outer skin of the Front Bulkhead
• The lamination must fully enclose the Anti Intrusion Plate and have shear capability
higher than 120 kN"
213,F.8.3,Composite Anti Intrusion Plate
214,F.8.3.1,"Composite Anti Intrusion Plates:
a. Must not fail in a frontal impact
b. Must withstand a minimum static load of 120 kN distributed over the 200 mm x 100 mm
minimum Impact Attenuator area"
215,F.8.3.2,"Strength of the Composite Anti Intrusion Plate must be verified by one of the two methods:
a. Physical testing of the AIP attached to a structurally representative section of the
intended chassis
• The test fixture must have equivalent strength and stiffness to a baseline front
bulkhead or must be the same as the first 50 mm of the Chassis
• Test data is valid for only one Competition Year
b. Laminate material testing under F.4.3.2 and F.4.3.5 and calculations of 3 point bending
and perimeter shear"
216,F.8.4,Impact Attenuator - IA
217,F.8.4.1,"Teams must do one of:
• Use an approved Standard Impact Attenuator from the FSAE Online Website
• Build and test a Custom Impact Attenuator of their own design F.8.8"
218,F.8.4.2,"The Custom Impact Attenuator must meet the following:
a. Length 200 mm or more, with its length oriented along the fore/aft axis of the Chassis.
b. Minimum height 100 mm (perpendicular to the ground) and minimum width 200 mm
(parallel to the ground) for a minimum distance of 200 mm forward of the Front
Bulkhead.
c. Segmented foam attenuators must have all segments bonded together to prevent sliding
or parallelogramming.
d. Honeycomb attenuators made of multiple segments must have a continuous panel
between each segment."
219,F.8.4.3,"If the outside profile of the Front Bulkhead is more than 400 mm x 350 mm, or the team uses
the Standard Honeycomb Impact Attenuator, and then one of the two must be met:
a. The Front Bulkhead must include an additional support that is a diagonal or X-brace that
meets F.3.2.1.b or Equivalent (integral or attached) for Monocoque bulkheads F.2.3.1
• The structure must go across the entire Front Bulkhead opening on the diagonal
• Attachment points at both ends must carry a minimum load of 30 kN in any
direction
b. Physical testing per F.8.8.6 and F.8.8.7 must be performed to prove that the Anti
Intrusion Plate does not permanently deflect more than 25 mm."
220,F.8.5,Impact Attenuator Attachment
221,F.8.5.1,"The attachment of the Impact Attenuator to the Anti Intrusion Plate or Front Bulkhead must
be documented in the SES submission"
222,F.8.5.2,"The Impact Attenuator must attach with an approved method:
Impact Attenuator Type Construction Attachment Method(s):
a. Standard or Custom Foam, Honeycomb Bonding
b. Custom other Bonding, Welding, Bolting"
223,F.8.5.3,"If the Impact Attenuator is attached by bonding:
a. Bonding must meet F.5.5
b. The shear strength of the bond must be higher than:
• 95 kN for foam Impact Attenuators
• 38.5 kN for honeycomb Impact Attenuators
• The maximum compressive force for custom Impact Attenuators
c. The entire surface of a foam Impact Attenuator must be bonded
d. Only the pre-crushed area of a honeycomb Impact Attenuator may be used for bond
equivalence"
224,F.8.5.4,"If the Impact Attenuator is attached by welding:
a. Welds may be continuous or interrupted
b. If interrupted, the weld/space ratio must be 1:1 or higher
c. All weld lengths must be more than 25 mm"
225,F.8.5.5,"If the Impact Attenuator is attached by bolting:
a. Must have no less than eight 8 mm or 5/16” minimum diameter Critical Fasteners, T.8.2
b. The distance between any two bolt centers must be 50 mm minimum
c. Each bolt attachment must have pullout, tearout and bending capabilities of 15 kN
d. Must be bolted directly to the Primary Structure"
226,F.8.5.6,"Impact Attenuator Position
a. All Impact Attenuators must mount with the bottom leading edge no more than 220 mm
above the lowest point on the top of the Lower Side Impact Structure
b. A Custom Impact Attenuator must mount with an area of 200 mm or more long and 200
mm or more wide that intersects a plane parallel to the ground that is no more than 220
mm above the lowest point on the top of the Lower Side Impact Structure"
227,F.8.5.7,"Impact Attenuator Orientation
a. The Impact Attenuator must be centered laterally on the Front Bulkhead
b. Standard Honeycomb must be mounted 200mm width x 100mm height
c. Standard Foam may be mounted laterally or vertically"
228,F.8.6,Front Impact Objects
229,F.8.6.1,"The only items allowed forward of the Anti Intrusion Plate in front view are the Impact
Attenuator, fastener heads, and light bodywork / nosecones
Fasteners should be oriented with the nuts rearwards"
230,F.8.6.2,"Front Wing and Bodywork Attachment
a. The front wing and front wing mounts must be able to move completely aft of the Anti
Intrusion Plate and not touch the front bulkhead during a frontal impact
b. The attachment points for the front wing and bodywork mounts should be aft of the Anti
Intrusion Plate
c. Tabs for wing and bodywork attachment must not extend more than 25mm forward of
the Anti Intrusion Plate"
231,F.8.6.3,"Pedal assembly at full travel and adjustment must have a minimum 25 mm clearance to the:
a. Rear face of the Anti Intrusion Plate
b. All Front Bulkhead structure F.6.1, F.7.2, F.8.4.3
c. All Non Crushable Items inside the Primary Structure
Non Crushable Items include, but are not limited to batteries, master cylinders, hydraulic
reservoirs"
232,F.8.7,Front Impact Verification
233,F.8.7.1,"The combination of the Impact Attenuator assembly and the force to crush or detach all other
items forward of the Anti Intrusion plate must not exceed the peak deceleration specified in
F.8.8.2
Ignore light bodywork, light nosecones, and outboard wheel assemblies"
234,F.8.7.2,"The peak load for the type of Impact Attenuator:
• Standard Foam Impact Attenuator 95 kN
• Standard Honeycomb Impact Attenuator 60 kN
• Tested Impact Attenuator peak as measured"
235,F.8.7.3,Use the Test Method F.8.7.4 or the Calculation Method F.8.7.5 to prove the force requirement
236,F.8.7.4,"Test Method
Get the peak force from physical testing of the Impact Attenuator and any Non Crushable
Object(s) as one of the two:
a. Tested together with the Impact Attenuator
b. Tested with the Impact Attenuator not attached, and add the peak load from F.8.7.2"
237,F.8.7.5,"Calculation Method
a. Calculate a failure load for the mounting of the Non Crushable Object(s) from fastener
shear, tearout, and/or link buckling
b. Add the peak attenuator load from F.8.7.2"
